StartDate,EndDate,Status,Progress,Duration (in seconds),Finished,RecordedDate,ResponseId,DistributionChannel,UserLanguage,Q_RecaptchaScore,Q3.6,Q4.2,Q4.2_4_TEXT,Q4.3,Q4.4,Q4.6_1,Q4.6_2,Q4.6_3,Q4.6_4,Q7.4_First Click,Q7.4_Last Click,Q7.4_Page Submit,Q7.4_Click Count,Q8.5_NPS_GROUP,Q8.5,Q8.6_NPS_GROUP,Q8.6,Q8.7_NPS_GROUP,Q8.7,Q8.8_NPS_GROUP,Q8.8,Q8.10_First Click,Q8.10_Last Click,Q8.10_Page Submit,Q8.10_Click Count,Q9.2_1,Q9.2_2,Q9.2_3,Q9.2_4,Q9.2_5,Q9.2_6,Q9.2_7,Q9.3_NPS_GROUP,Q9.3,Q9.5_First Click,Q9.5_Last Click,Q9.5_Page Submit,Q9.5_Click Count,Q10.4_NPS_GROUP,Q10.4,Q10.5_NPS_GROUP,Q10.5,Q10.6_NPS_GROUP,Q10.6,Q10.7_NPS_GROUP,Q10.7,Q10.8_NPS_GROUP,Q10.8,Q10.9_NPS_GROUP,Q10.9,Q10.11_First Click,Q10.11_Last Click,Q10.11_Page Submit,Q10.11_Click Count,Q11.2,Q14.16_First Click,Q14.16_Last Click,Q14.16_Page Submit,Q14.16_Click Count,Q17.4_First Click,Q17.4_Last Click,Q17.4_Page Submit,Q17.4_Click Count,Q18.5_NPS_GROUP,Q18.5,Q18.6_NPS_GROUP,Q18.6,Q18.7_NPS_GROUP,Q18.7,Q18.8_NPS_GROUP,Q18.8,Q18.10_First Click,Q18.10_Last Click,Q18.10_Page Submit,Q18.10_Click Count,Q19.2_1,Q19.2_2,Q19.2_3,Q19.2_4,Q19.2_5,Q19.2_6,Q19.2_7,Q19.3_NPS_GROUP,Q19.3,Q19.5_First Click,Q19.5_Last Click,Q19.5_Page Submit,Q19.5_Click Count,Q20.4_NPS_GROUP,Q20.4,Q20.5_NPS_GROUP,Q20.5,Q20.6_NPS_GROUP,Q20.6,Q20.7_NPS_GROUP,Q20.7,Q20.8_NPS_GROUP,Q20.8,Q20.9_NPS_GROUP,Q20.9,Q20.11_First Click,Q20.11_Last Click,Q20.11_Page Submit,Q20.11_Click Count,Q21.2,Q23.2_NPS_GROUP,Q23.2,Q23.3_NPS_GROUP,Q23.3,Q23.4_NPS_GROUP,Q23.4,Q23.5_NPS_GROUP,Q23.5,Q23.7_1,Q23.7_2,Q23.8,Q23.10_First Click,Q23.10_Last Click,Q23.10_Page Submit,Q23.10_Click Count,Group
Start Date,End Date,Response Type,Progress,Duration (in seconds),Finished,Recorded Date,Response ID,Distribution Channel,User Language,Q_RecaptchaScore,"Informed Consent (Required)


I have read and understood the above information and agree to participate in this research study and consent to the use of data recorded during this study for the purposes stated in the previous section.



I understand that my identity will remain private, and that my non-identifying data may be shared with other people as part of this research.



I understand that my decision does not affect my relationship with the University of New Brunswick, even if I decide to drop out of the study. I agree that all my questions and concerns have been answered.



Please enter your name to confirm your consent for this study.",How do you describe yourself? - Selected Choice,How do you describe yourself? - Prefer to self-describe - Text,How old are you?,Level of Education completed (Canada),Please read and answer below questions. - I use computer or smart phone for internet browsing.,"Please read and answer below questions. - I use search engines. Example: Google, Bing, Yahoo, Baidu, etc.","Please read and answer below questions. - I use social media. Example: Facebook, X (formerly Twitter), Reddit, Instagram.","Please read and answer below questions. - I have used AI-powered tools. Example: ChatGPT, Grammarly, Copilot, etc.",Timing - First Click,Timing - Last Click,Timing - Page Submit,Timing - Click Count,I am satisfied with the text format and layout of the Terms and Conditions agreement? - Group,I am satisfied with the text format and layout of the Terms and Conditions agreement?,I am satisfied with the length of the Terms and Conditions agreement? - Group,I am satisfied with the length of the Terms and Conditions agreement?,I am satisfied with the clarity and readability of the Terms and Conditions agreement? - Group,I am satisfied with the clarity and readability of the Terms and Conditions agreement?,I am confident that I understood the Terms and Conditions agreement? - Group,I am confident that I understood the Terms and Conditions agreement?,Timing - First Click,Timing - Last Click,Timing - Page Submit,Timing - Click Count,To what extent do you agree with the following statement: - The platform will be accessible to users aged 13 and above.,"To what extent do you agree with the following statement: - The platform can protect my personal data, including my identity and location.",To what extent do you agree with the following statement: - The underlying machine learning model will generate fair and unbiased recommendations.,To what extent do you agree with the following statement: - The platform may share my social media activities to my potential employer.,To what extent do you agree with the following statement: - I am liable for the content I share if it is used for any harmful activities.,To what extent do you agree with the following statement: - The platform will collect images stored in my device.,"To what extent do you agree with the following statement: - The platform will not collect, share or sell my location information.",I am confident in my answers to the previous questions. - Group,I am confident in my answers to the previous questions.,Timing - First Click,Timing - Last Click,Timing - Page Submit,Timing - Click Count,How mentally demanding was interpreting the text-only Terms and Conditions agreement? - Group,How mentally demanding was interpreting the text-only Terms and Conditions agreement?,How physically demanding was the text-only Terms and Conditions agreement? - Group,How physically demanding was the text-only Terms and Conditions agreement?,How hurried or rushed was the pace for interpreting the text-only Terms and Conditions agreement? - Group,How hurried or rushed was the pace for interpreting the text-only Terms and Conditions agreement?,How successful were you in accomplishing what you were asked to do? - Group,How successful were you in accomplishing what you were asked to do?,How hard did you have to work to accomplish your level of performance? - Group,How hard did you have to work to accomplish your level of performance?,"How insecure, discouraged, irritated, stressed, and annoyed were you while reading the Terms and Conditions agreement? - Group","How insecure, discouraged, irritated, stressed, and annoyed were you while reading the Terms and Conditions agreement?",Timing - First Click,Timing - Last Click,Timing - Page Submit,Timing - Click Count,Additional Comments,Timing - First Click,Timing - Last Click,Timing - Page Submit,Timing - Click Count,Timing - First Click,Timing - Last Click,Timing - Page Submit,Timing - Click Count,I am satisfied with the text format and layout of the Terms and Conditions agreement? - Group,I am satisfied with the text format and layout of the Terms and Conditions agreement?,I am satisfied with the length of the Terms and Conditions agreement? - Group,I am satisfied with the length of the Terms and Conditions agreement?,I am satisfied with the clarity and readability of the Terms and Conditions agreement? - Group,I am satisfied with the clarity and readability of the Terms and Conditions agreement?,I am confident that I understood the Terms and Conditions agreement? - Group,I am confident that I understood the Terms and Conditions agreement?,Timing - First Click,Timing - Last Click,Timing - Page Submit,Timing - Click Count,To what extent do you agree with the following statement: - The platform will be accessible to users aged 13 and above.,"To what extent do you agree with the following statement: - The platform can safeguard my personal data, including my identity and location.",To what extent do you agree with the following statement: - The underlying machine learning model will generate fair and unbiased recommendations.,To what extent do you agree with the following statement: - The platform may share my social media activities to my potential employer.,To what extent do you agree with the following statement: - I am liable for the content I share if it is used for any harmful activities.,To what extent do you agree with the following statement: - The platform will collect images stored in my device.,"To what extent do you agree with the following statement: - The platform will not collect, share or sell my location information.",I am confident in my answers to the previous questions. - Group,I am confident in my answers to the previous questions.,Timing - First Click,Timing - Last Click,Timing - Page Submit,Timing - Click Count,How mentally demanding was interpreting the visual Terms and Conditions? - Group,How mentally demanding was interpreting the visual Terms and Conditions?,How physically demanding was the visual Terms and Conditions? - Group,How physically demanding was the visual Terms and Conditions?,How hurried or rushed was the pace for interpreting the visual Terms and Conditions? - Group,How hurried or rushed was the pace for interpreting the visual Terms and Conditions?,How successful were you in accomplishing what you were asked to do? - Group,How successful were you in accomplishing what you were asked to do?,How hard did you have to work to accomplish your level of performance? - Group,How hard did you have to work to accomplish your level of performance?,"How insecure, discouraged, irritated, stressed, and annoyed were you while reading the Terms and Conditions? - Group","How insecure, discouraged, irritated, stressed, and annoyed were you while reading the Terms and Conditions?",Timing - First Click,Timing - Last Click,Timing - Page Submit,Timing - Click Count,Additional Comments,I am concerned with the platform's personal data collection and usage. - Group,I am concerned with the platform's personal data collection and usage.,I am concerned with the platform's personal data processing practice. - Group,I am concerned with the platform's personal data processing practice.,I am concerned about platform's personal data selling practice. - Group,I am concerned about platform's personal data selling practice.,I am concerned about platform’s machine learning model's accuracy and generating fair recommendations. - Group,I am concerned about platform’s machine learning model's accuracy and generating fair recommendations.,Please rate the version that assisted you to understand Terms and Conditions better. - Text Only Terms and Conditions,Please rate the version that assisted you to understand Terms and Conditions better. - Visual Terms and Conditions,Additional Comments,Timing - First Click,Timing - Last Click,Timing - Page Submit,Timing - Click Count,Group
"{""ImportId"":""startDate"",""timeZone"":""Canada/Atlantic""}","{""ImportId"":""endDate"",""timeZone"":""Canada/Atlantic""}","{""ImportId"":""status""}","{""ImportId"":""progress""}","{""ImportId"":""duration""}","{""ImportId"":""finished""}","{""ImportId"":""recordedDate"",""timeZone"":""Canada/Atlantic""}","{""ImportId"":""_recordId""}","{""ImportId"":""distributionChannel""}","{""ImportId"":""userLanguage""}","{""ImportId"":""Q_RecaptchaScore""}","{""ImportId"":""QID6_TEXT""}","{""ImportId"":""QID10""}","{""ImportId"":""QID10_4_TEXT""}","{""ImportId"":""QID117_TEXT""}","{""ImportId"":""QID12""}","{""ImportId"":""QID13_1""}","{""ImportId"":""QID13_2""}","{""ImportId"":""QID13_3""}","{""ImportId"":""QID13_4""}","{""ImportId"":""QID150_FIRST_CLICK""}","{""ImportId"":""QID150_LAST_CLICK""}","{""ImportId"":""QID150_PAGE_SUBMIT""}","{""ImportId"":""QID150_CLICK_COUNT""}","{""ImportId"":""QID30_NPS_GROUP""}","{""ImportId"":""QID30""}","{""ImportId"":""QID32_NPS_GROUP""}","{""ImportId"":""QID32""}","{""ImportId"":""QID31_NPS_GROUP""}","{""ImportId"":""QID31""}","{""ImportId"":""QID33_NPS_GROUP""}","{""ImportId"":""QID33""}","{""ImportId"":""QID151_FIRST_CLICK""}","{""ImportId"":""QID151_LAST_CLICK""}","{""ImportId"":""QID151_PAGE_SUBMIT""}","{""ImportId"":""QID151_CLICK_COUNT""}","{""ImportId"":""QID36_1""}","{""ImportId"":""QID36_2""}","{""ImportId"":""QID36_3""}","{""ImportId"":""QID36_4""}","{""ImportId"":""QID36_5""}","{""ImportId"":""QID36_6""}","{""ImportId"":""QID36_7""}","{""ImportId"":""QID37_NPS_GROUP""}","{""ImportId"":""QID37""}","{""ImportId"":""QID152_FIRST_CLICK""}","{""ImportId"":""QID152_LAST_CLICK""}","{""ImportId"":""QID152_PAGE_SUBMIT""}","{""ImportId"":""QID152_CLICK_COUNT""}","{""ImportId"":""QID41_NPS_GROUP""}","{""ImportId"":""QID41""}","{""ImportId"":""QID42_NPS_GROUP""}","{""ImportId"":""QID42""}","{""ImportId"":""QID43_NPS_GROUP""}","{""ImportId"":""QID43""}","{""ImportId"":""QID44_NPS_GROUP""}","{""ImportId"":""QID44""}","{""ImportId"":""QID45_NPS_GROUP""}","{""ImportId"":""QID45""}","{""ImportId"":""QID46_NPS_GROUP""}","{""ImportId"":""QID46""}","{""ImportId"":""QID153_FIRST_CLICK""}","{""ImportId"":""QID153_LAST_CLICK""}","{""ImportId"":""QID153_PAGE_SUBMIT""}","{""ImportId"":""QID153_CLICK_COUNT""}","{""ImportId"":""QID50_TEXT""}","{""ImportId"":""QID154_FIRST_CLICK""}","{""ImportId"":""QID154_LAST_CLICK""}","{""ImportId"":""QID154_PAGE_SUBMIT""}","{""ImportId"":""QID154_CLICK_COUNT""}","{""ImportId"":""QID155_FIRST_CLICK""}","{""ImportId"":""QID155_LAST_CLICK""}","{""ImportId"":""QID155_PAGE_SUBMIT""}","{""ImportId"":""QID155_CLICK_COUNT""}","{""ImportId"":""QID66_NPS_GROUP""}","{""ImportId"":""QID66""}","{""ImportId"":""QID68_NPS_GROUP""}","{""ImportId"":""QID68""}","{""ImportId"":""QID67_NPS_GROUP""}","{""ImportId"":""QID67""}","{""ImportId"":""QID69_NPS_GROUP""}","{""ImportId"":""QID69""}","{""ImportId"":""QID156_FIRST_CLICK""}","{""ImportId"":""QID156_LAST_CLICK""}","{""ImportId"":""QID156_PAGE_SUBMIT""}","{""ImportId"":""QID156_CLICK_COUNT""}","{""ImportId"":""QID72_1""}","{""ImportId"":""QID72_2""}","{""ImportId"":""QID72_3""}","{""ImportId"":""QID72_4""}","{""ImportId"":""QID72_5""}","{""ImportId"":""QID72_6""}","{""ImportId"":""QID72_7""}","{""ImportId"":""QID73_NPS_GROUP""}","{""ImportId"":""QID73""}","{""ImportId"":""QID157_FIRST_CLICK""}","{""ImportId"":""QID157_LAST_CLICK""}","{""ImportId"":""QID157_PAGE_SUBMIT""}","{""ImportId"":""QID157_CLICK_COUNT""}","{""ImportId"":""QID78_NPS_GROUP""}","{""ImportId"":""QID78""}","{""ImportId"":""QID79_NPS_GROUP""}","{""ImportId"":""QID79""}","{""ImportId"":""QID80_NPS_GROUP""}","{""ImportId"":""QID80""}","{""ImportId"":""QID81_NPS_GROUP""}","{""ImportId"":""QID81""}","{""ImportId"":""QID82_NPS_GROUP""}","{""ImportId"":""QID82""}","{""ImportId"":""QID83_NPS_GROUP""}","{""ImportId"":""QID83""}","{""ImportId"":""QID158_FIRST_CLICK""}","{""ImportId"":""QID158_LAST_CLICK""}","{""ImportId"":""QID158_PAGE_SUBMIT""}","{""ImportId"":""QID158_CLICK_COUNT""}","{""ImportId"":""QID86_TEXT""}","{""ImportId"":""QID92_NPS_GROUP""}","{""ImportId"":""QID92""}","{""ImportId"":""QID93_NPS_GROUP""}","{""ImportId"":""QID93""}","{""ImportId"":""QID94_NPS_GROUP""}","{""ImportId"":""QID94""}","{""ImportId"":""QID95_NPS_GROUP""}","{""ImportId"":""QID95""}","{""ImportId"":""QID96_1""}","{""ImportId"":""QID96_2""}","{""ImportId"":""QID97_TEXT""}","{""ImportId"":""QID159_FIRST_CLICK""}","{""ImportId"":""QID159_LAST_CLICK""}","{""ImportId"":""QID159_PAGE_SUBMIT""}","{""ImportId"":""QID159_CLICK_COUNT""}","{""ImportId"":""Group""}"
